<?xml version="1.0" encoding="UTF-8"?>
<!ELEMENT listapersonas (persona*)>
<!ELEMENT persona (nombre, victorias, logros*)>
<!ELEMENT nombre (#PCDATA)>
<!ELEMENT victorias (#PCDATA)>
<!ELEMENT logros (logro+)>
<!ELEMENT logro (id, nombrelogro, descripcion, completado)>
<!ELEMENT id (#PCDATA)>
<!ELEMENT nombrelogro (#PCDATA)>
<!ELEMENT descripcion (#PCDATA)>
<!ELEMENT completado (#PCDATA)>